{
  "bindings": {
    "contract_raw_sha256": "6246ed73aea78dc605ec234b0fedf67f20e1fa830d285e6a4fd7242d68dda5d2",
    "preflight_report_raw_sha256": "446cebb7baedc27be8194170f3dd64a4a94412c89866d297fe72f87d459d0bf9",
    "schema_bundle_sha256": "effe68dc6c101df2b9abf1ef4b87e30b5e5ab1c74921f2b879cd7a333460d3a2"
  },
  "document_kind": "event_ledger",
  "events": [
    {
      "event_id": "registered",
      "event_kind": "contract_registered",
      "event_sha256": "ed8b2368348738ff5fb05e52daf5ecda1e65ac5959c9ab78dfcfe08aa6c9b221",
      "idempotency_key": "metric-invariance-128a-20261017:registered",
      "notification_status": "not_applicable",
      "occurred_at": "2026-10-16T18:09:36.019941+00:00",
      "phase": null,
      "previous_event_sha256": null,
      "relates_to_event_id": null,
      "sequence": 1,
      "verdict": "none"
    }
  ],
  "experiment_id": "metric-invariance-128a-20261017",
  "run_id": "run-20261017-128-metric-invariance",
  "schema_bundle_id": "harn-schema-v1",
  "schema_version": "1.0.0"
}
