{
  "document_kind": "event_ledger",
  "schema_version": "1.0.0",
  "schema_bundle_id": "harn-schema-v1",
  "experiment_id": "aes-negmf-control-diagnostic-20261003",
  "run_id": "run-20261003-99",
  "bindings": {
    "contract_raw_sha256": "b6ec3d1cc35048d866428a762fb389222e7087c194a52f99123416dea4f941c3",
    "preflight_report_raw_sha256": "fb078845ebba3709261330a4edaf510a278aa4eab46633a1ccacb96f37b624ea",
    "schema_bundle_sha256": "effe68dc6c101df2b9abf1ef4b87e30b5e5ab1c74921f2b879cd7a333460d3a2"
  },
  "events": [
    {
      "sequence": 1,
      "event_id": "contract-register",
      "idempotency_key": "aes-negmf-control-diagnostic-20261003:contract-register",
      "event_kind": "contract_registered",
      "occurred_at": "2026-10-03T12:49:52.358413+00:00",
      "phase": null,
      "verdict": "none",
      "relates_to_event_id": null,
      "notification_status": "not_applicable",
      "previous_event_sha256": null,
      "event_sha256": "c7e53fa20586a710e4aa5504e576c5f922a97de465e635e0de4fedc57950a533"
    }
  ]
}
