{
  "bindings": {
    "contract_raw_sha256": "252fe15f93720c3dc80d298190a99348503353aeb706e0060973491334761734",
    "preflight_report_raw_sha256": "013e8ce3cb3aec720dc476dd739627aa30ca34f09b470364c312baa43d6c0bb7",
    "schema_bundle_sha256": "effe68dc6c101df2b9abf1ef4b87e30b5e5ab1c74921f2b879cd7a333460d3a2"
  },
  "document_kind": "event_ledger",
  "events": [
    {
      "event_id": "registered",
      "event_kind": "contract_registered",
      "event_sha256": "dcbb9478e9bbc815c7957619e8dbdbd254a74bd2f017a2f2ed946c6ccc75b899",
      "idempotency_key": "metric-invariance-128c-20261017_nvme_r5:registered",
      "notification_status": "not_applicable",
      "occurred_at": "2026-10-17T17:37:15.629099+00:00",
      "phase": null,
      "previous_event_sha256": null,
      "relates_to_event_id": null,
      "sequence": 1,
      "verdict": "none"
    }
  ],
  "experiment_id": "metric-invariance-128c-20261017_nvme_r5",
  "run_id": "run-20261018-130-metric-invariance_nvme_r5",
  "schema_bundle_id": "harn-schema-v1",
  "schema_version": "1.0.0"
}
