{
  "bindings": {
    "contract_raw_sha256": "4d11ff308e10b6e3a21c35b537eca7ac032967ee43e561d40d73b8eb28e33d73",
    "preflight_report_raw_sha256": "1989486e0ca593f6fc5d59d704d53cfd94a17c1e70482718524ad6ad55281d3d",
    "schema_bundle_sha256": "effe68dc6c101df2b9abf1ef4b87e30b5e5ab1c74921f2b879cd7a333460d3a2"
  },
  "document_kind": "event_ledger",
  "events": [
    {
      "event_id": "registered",
      "event_kind": "contract_registered",
      "event_sha256": "da4c03c08e1460d9e48c30389c1e2fd45446978ce9ee70fa7dcc629e08e190d8",
      "idempotency_key": "metric-invariance-128c-20261017_claims_r4:registered",
      "notification_status": "not_applicable",
      "occurred_at": "2026-10-17T17:14:23.826044+00:00",
      "phase": null,
      "previous_event_sha256": null,
      "relates_to_event_id": null,
      "sequence": 1,
      "verdict": "none"
    }
  ],
  "experiment_id": "metric-invariance-128c-20261017_claims_r4",
  "run_id": "run-20261018-130-metric-invariance_claims_r4",
  "schema_bundle_id": "harn-schema-v1",
  "schema_version": "1.0.0"
}
