{
  "bindings": {
    "contract_raw_sha256": "0b81ece1548bcb123898e0319f5700d684a450205077b1f908120440aa4e7598",
    "preflight_report_raw_sha256": "a81b45a21ddaf01c9786bc0daeac0c2b63ee3830af8e8a81762a7a26eec959ab",
    "schema_bundle_sha256": "effe68dc6c101df2b9abf1ef4b87e30b5e5ab1c74921f2b879cd7a333460d3a2"
  },
  "document_kind": "event_ledger",
  "events": [
    {
      "event_id": "registered",
      "event_kind": "contract_registered",
      "event_sha256": "a23aec685c32f72cfbd61763b064e40498980e46ae177c0a23c28339b4982b0f",
      "idempotency_key": "metric-invariance-128c-20261017_budget_r3:registered",
      "notification_status": "not_applicable",
      "occurred_at": "2026-10-17T01:49:00.441551+00:00",
      "phase": null,
      "previous_event_sha256": null,
      "relates_to_event_id": null,
      "sequence": 1,
      "verdict": "none"
    }
  ],
  "experiment_id": "metric-invariance-128c-20261017_budget_r3",
  "run_id": "run-20261017-130-metric-invariance_budget_r3",
  "schema_bundle_id": "harn-schema-v1",
  "schema_version": "1.0.0"
}
