{
  "bindings": {
    "contract_raw_sha256": "fe53ead51f21c2326411e492509f9afdddc9a8aabf015c6e756c8608d425cf95",
    "preflight_report_raw_sha256": "63aeeef1d9970dc8e93adaaa31b7b628eb61588ede0bb3e929e4b83306feba9e",
    "schema_bundle_sha256": "effe68dc6c101df2b9abf1ef4b87e30b5e5ab1c74921f2b879cd7a333460d3a2"
  },
  "document_kind": "event_ledger",
  "events": [
    {
      "event_id": "registered",
      "event_kind": "contract_registered",
      "event_sha256": "5723ed9eaa3b793c10e2fe73f9def21638abb5fdde1e95c36fe91b12497840c7",
      "idempotency_key": "metric-invariance-128b-20261017_quiet_r2:registered",
      "notification_status": "not_applicable",
      "occurred_at": "2026-10-17T01:31:44.656277+00:00",
      "phase": null,
      "previous_event_sha256": null,
      "relates_to_event_id": null,
      "sequence": 1,
      "verdict": "none"
    }
  ],
  "experiment_id": "metric-invariance-128b-20261017_quiet_r2",
  "run_id": "run-20261017-129-metric-invariance_quiet_r2",
  "schema_bundle_id": "harn-schema-v1",
  "schema_version": "1.0.0"
}
