{
  "bindings": {
    "contract_raw_sha256": "428a0f1d3df3d0b5f007b7c50cb407fb5c051e3d872aaf9c6326989ac8f2456f",
    "preflight_report_raw_sha256": "79130c7b72866fc736bc231f6e5672eba532e7e73374e2ef7d5c9a7eb26ee5cc",
    "schema_bundle_sha256": "effe68dc6c101df2b9abf1ef4b87e30b5e5ab1c74921f2b879cd7a333460d3a2"
  },
  "document_kind": "event_ledger",
  "events": [
    {
      "event_id": "registered",
      "event_kind": "contract_registered",
      "event_sha256": "892a3e316b12b53745c7135f8f41991e6f6377002213f30383ff51fc61528946",
      "idempotency_key": "metric-invariance-128b-20261017:registered",
      "notification_status": "not_applicable",
      "occurred_at": "2026-10-16T18:09:36.146984+00:00",
      "phase": null,
      "previous_event_sha256": null,
      "relates_to_event_id": null,
      "sequence": 1,
      "verdict": "none"
    }
  ],
  "experiment_id": "metric-invariance-128b-20261017",
  "run_id": "run-20261017-129-metric-invariance",
  "schema_bundle_id": "harn-schema-v1",
  "schema_version": "1.0.0"
}
