{
  "bindings": {
    "contract_raw_sha256": "9156c2882798aba345711de772b7461f516d530b6f45a233bedbb3b9e494c454",
    "preflight_report_raw_sha256": "2c7bc008a91b1e6af4cee11f3f7521a417acb262335521e4fa57d2aee35a3cff",
    "schema_bundle_sha256": "effe68dc6c101df2b9abf1ef4b87e30b5e5ab1c74921f2b879cd7a333460d3a2"
  },
  "document_kind": "event_ledger",
  "events": [
    {
      "event_id": "registered",
      "event_kind": "contract_registered",
      "event_sha256": "abf206a1e0bba6554fa59cf70fc504ccdae05de1f4ca56ba23d04a0f7fecce3d",
      "idempotency_key": "metric-invariance-128c-20261017_identity_r1:registered",
      "notification_status": "not_applicable",
      "occurred_at": "2026-10-17T00:45:29.723726+00:00",
      "phase": null,
      "previous_event_sha256": null,
      "relates_to_event_id": null,
      "sequence": 1,
      "verdict": "none"
    }
  ],
  "experiment_id": "metric-invariance-128c-20261017_identity_r1",
  "run_id": "run-20261017-130-metric-invariance_identity_r1",
  "schema_bundle_id": "harn-schema-v1",
  "schema_version": "1.0.0"
}
