{
  "bindings": {
    "contract_raw_sha256": "605144635b19dee688d38f13daa3429d3069df2c61801ec6415e57bceca07167",
    "preflight_report_raw_sha256": "5a4e84258f9816b13e69307376248efb44a39823b7ce687d648fcc597308f7d0",
    "schema_bundle_sha256": "effe68dc6c101df2b9abf1ef4b87e30b5e5ab1c74921f2b879cd7a333460d3a2"
  },
  "document_kind": "event_ledger",
  "events": [
    {
      "event_id": "registered",
      "event_kind": "contract_registered",
      "event_sha256": "3c0fbbba0ba468d408a37a486e219ba6592753ad5dfad0f90e8ddceb5e42261a",
      "idempotency_key": "metric-invariance-128a-20261017_quiet_r2:registered",
      "notification_status": "not_applicable",
      "occurred_at": "2026-10-17T01:31:44.537717+00:00",
      "phase": null,
      "previous_event_sha256": null,
      "relates_to_event_id": null,
      "sequence": 1,
      "verdict": "none"
    }
  ],
  "experiment_id": "metric-invariance-128a-20261017_quiet_r2",
  "run_id": "run-20261017-128-metric-invariance_quiet_r2",
  "schema_bundle_id": "harn-schema-v1",
  "schema_version": "1.0.0"
}
